",""X1"",""X2""";;
"1,""this vacuum is good if you only have hardwood floors and no carpet or rug. i mean 0. everyday mine would get stuck and i have low pile. even my 2 year-old shark ion do a better job. big fail for Deebot. will be returning."",""Reviewed in the United States on September 24, 2020""";;
"2,""I loved this vacuum but the last couple months it’s very loud and sounds like it may be struggling a little. I need to replace the parts, sweepers have been destroyed picking up hair and getting caught in the rug. Over all a good purchase. Not sure how much longer it will last by the noises coming from it though."",""Reviewed in the United States on September 24, 2020""";;
"3,""I would have given this 5 stars but after 3 months of use, it stopped working... very disappointing!!"",""Reviewed in the United States on September 23, 2020""";;
"4,""Absolutely waste of money , stopped working after few use contacted the DEEBOT assistant line their response was “we are unable to help you have to purchase a new one “  but they were generous enough to give me 20 percent off of the new purchase lol what a joke"",""Reviewed in the United States on September 23, 2020""";;
"5,""We've had Deebot for just over a year and a half. We don't use it as much as some people - it's more of a supplement for us when we don't feel like getting out the Kirby, so it gets run about 2-3 times a month at most. Otherwise it always lives in its cradle.About two months ago it stopped working. That is - it would run for a few minutes, then start beeping four beeps with a red light. Doing extensive internet research suggested that Deebot needed a good deep cleaning and possibly a new battery. I followed multiple videos to clean all the hair out of every wheel, nook, and cranny that existed, but still the same. So we shelled out the $25 for a new battery.And today I tried to run it for the first time after the new battery has been charging for several days... and once again, it went for a few minutes, stopped in the middle of the room not near anything, and started the four beeps.So I guess, if you shell out hundreds of dollars for this thing, be sure to understand that it is a """"disposable"""" product that will only last about 16 months, and then will be completely broken beyond repair, even if you follow the company's instructions and shell out additional money for a battery."",""Reviewed in the United States on September 23, 2020""";;
"6,""For those that don't want to read the entire report. DO NOT BUY if you intend on keeping it for a long-term use.I bought this Deebot 2 years ago, and finally decided to give it a review. For the first 9 months, the Deebot worked decently well for a family home and a shedding dog. We constantly cleaned it out after every use, which is expected since we ran it 3 times a week. We did have to slightly rearrange the house everytime since it does not have the capability to avoid most minor obstacles. Overall, we were pleased with the Deebot.Here is were it started to get frustrating as time went by. By 10 months it started having issues with the battery life and software. Imagine it cleaning a 1,500 sq ft area and then, dropping down to 750 sq ft area before it was triggerd it to find the charging port due to a low battery. This, from our observations, was a sharp decline in battery life. It was nearly an instant occurrence where it had issues cleaning.We replaced and cleaned the deebot accessories when needed or recommended by the app associated with the Deebot.By the 11th month, the software started to have issues. It would blink various stages of red and cease to clean. This is when we called customer service to get a replacement. We followed various cleaning and troubleshooting instructions before they decided to replace it. Nothing out of the ordinary for companies to do. However, we had to send in the old Deebot before receiving a replacement. Once it was sent, it took a number of weeks to recieve the replacement.They sent us a refurbished Deebot as a replacement and we immediately had issues with the Deebots software. It would randomly blink red and beep when charging (generally within the first 10 minutes of charging), try to go over obstacles rather than avoid them, and still had battery half-life battery. It was as if, they decided to give me a replacement of my old one with additional issues. Granted, it did clean the area until the battery was low this time. When we called, it was too late! We were over the 12 month warranty and all they could do, or want to do, was buy a new one or we had to pay to get it fixed. Low and behold, we stuck with it for a year with all it's issues to at least use it until it is ready to be in the grave.We are now in the market to buy another vaccum. They have been a lifesaver when it comes to sweeping hairs and miscellaneous nonsense. Plus, I feel it does a better job sweeping than myself.Nevertheless, having a robo-vaccum has been a 1st world saver for reducing time and ensure a decent clean. Would I get a Deebot again... NO I wouldn't. This time I am looking for quality product and a company that will stand behind it with more than just a one year warranty.Why???Because I take care of my stuff with the expectation that it will last for years. This obviously does not possess qualities that will last.FYI, the 2 deebots we have had have normal wear and tear from bouncing of objects and what have you. They were not abused, damaged, or tinkered with. However, a few nights ago the Deebot decided to force its way through an area that has a lip under the dishwasher. When I mean forced, it used all its might and power to get under there. It wasn't until I went in the Kitchen because I heard it in the kitchen longer than it normally does. When I pulled it out, trying to inflict the least damage to the device and appliance, the result is in the picture."",""Reviewed in the United States on September 23, 2020""";;
"7,""In general, the product is great, clean up all hairs in the room. However, hairs do get stuck inside and not sucked in. Another problem is that its navigation ability is some what not so great. It can repetitively clean one place but not so much in other places."",""Reviewed in the United States on September 23, 2020""";;
"8,""Si no lo veo no lo creo. No se de donde recogió todo eso. Muy contenta. Se entra en todo lado debajo de los mueble , la cama el baño. Todoooo. Estoy súper feliz. No hace ruido."",""Reviewed in the United States on September 22, 2020""";;
"9,""I ordered a machine and it came in looking used. I requested a new machine. I got the new machine, no problem as I did the exchange through Amazon's return process.  Quick, painless, and easy.So why the 1 star rating you ask? Well, well, well. Where do I begin after that?The problems: The machine will not connect to the app. Never has, never will.It is so out of wack it turns on in the middle of the night waking me up.It barely works on a repeated cycle like its supposed too.It doesn't go to any other rooms other than my living room.It stopped working completely. I've gotten in touch with the manufacturer because my extended warranty has not picked up yet until the manufacturer is done. They have been an ABSOLUTE NIGHTMARE. They are the least helpful people in the world. I am supposed to be out of a machine for who knows how long. They insist I ship it back to China for it to be worked on and if it can't be fixed they will send me a refurbished one. I've requested a replacement in the meantime...this has been going on since January. I still have not been able to send my machine back.I would have rather spent the extra money getting a more reputable company that doesn't let their customers go through a grace period of 9 months without a working machine. I also am infuriated I bought an extended warranty on a product that I cannot utilize it on. Save up more money and buy from a better company. Because trust me the back and forth talk of fixing my machine has been awful and I am so busy I got this thinking that it would save me time vacuuming. It has not saved me anytime doing anything."",""Reviewed in the United States on September 22, 2020""";;
"10,""Overpriced garbage. It stopped working after few month. Now, it only goes in circles and then stops."",""Reviewed in the United States on September 22, 2020""";;
"11,""I got this a while back but didn't start using it until June of this year (it's now September).It was fine at first, definitely not as smart as a Roomba but did the job. I bought it when it was on sale so the discount as significant enough to not just buy a Roomba.Well maybe I should have bought a Roomba because today, for literally no reason at all, the motor started making a loud whirring sound as it was vaccuming. And then after 10 minutes of that, the motor died and now it no longer vacuums.So now I just have a robot that walks around the room.Needless to say, I won't be replacing it."",""Reviewed in the United States on September 21, 2020""";;
"12,""I bought my Ecovacs 11 months ago.  My house is all hard surfaces, and I have three dogs.  I run the Ecovacs twice a day"; both times, the bin is full of hair and dust. I love the product;" however, I am not sure if it is powerful enough for all carpeted houses.FYI, The product was much cheaper when I bought it."",""Reviewed in the United States on September 21, 2020"""
"13,"" This product is very functional and does quite an exceptional job at picking up after little things on the floor. It has the facility to do automatic timing which I thought was pretty cool. It leaves the base station and then gets back to the station by itself at any designated time after doing a good job cleaning the room. I do this before I come home so my house is quite neat by the time I arrive. I would recommend this product to anyone who wants to automate cleaning in their house and leave less tasks on hand."",""Reviewed in the United States on September 21, 2020""";;
"14,""Died after a few months, finally fixed it only for it to non-stop malfunction.Ours died after only a few months, it wouldn't charge at all. We emailed customer service who told us this was normal (lol) and refused to refund us. They sent us instructions to fix it which actually worked. But now that it works it has a """"main brush malfunction"""" every 5-10 seconds. We have gone so far as to completely dismantle the unit and remove every single piece of debris, but it still breaks every 5-10 seconds. We will be investing in a roomba, this was a massive waste of money."",""Reviewed in the United States on September 20, 2020""";;
"15,""It will be two years soon since I’ve had my Deebot N79S and I made a great choice and investment. I use it specially in all the rooms and bathroom and also where I have my carpet in the living room the rest of the house I broom it myself because of course it needs to charge after all the dust cleaning. It does the job perfectly! As per the bad comments I’ve read, I mean! People should know what the machine does and does not before purchasing it other than criticizing its performing. I think it’s a great device"",""Reviewed in the United States on September 19, 2020""";;
"16,""I have a Roomba for 8 years and loved it. IT finally died. I wanted to try a less expensive brand. I searched reviews and opted for this one. It works really well and is considerable less noisy than my older roomba. It navigates well and picks up everything in its path. The only drawback is it is sluggish on a thick shag type rug in my daughter's room. I may be able to change a setting to correct that. Overall it is a wonderful device."",""Reviewed in the United States on September 17, 2020""";;
"17,"" Ecovacs/Deebot Support asked me purchase new parts to fix this vac after it was not working.  I had to send them multiple videos, proof of purchase, replace parts, only so they could tell me that the warranty was barely expired.  Worthless, spend your money elsewhere.  The ratio on 'number of times the floor was swept' / 'life of product' is TERRIBLE."",""Reviewed in the United States on September 16, 2020""";;
"18,""Had this for less than a year and totally lost suction";" customer service not helpful."",""Reviewed in the United States on September 16, 2020""";
"19,""Wow! When we first moved into our house, we bought our Deboot (Soon to be nicknamed Mr. Sucky). We had another vacuum but shortly after moving the belt broke. Mr Sucky was (and still is) doing such a fantastic job we just threw the vacuum away, and have not missed it once. He runs every night while we sleep. Occasionally, we will stick him in a room to clean. You do have to preclean the floor so there is nothing he will run over and get stuck in (he has vacuumed countless socks from our 3 Y/O, as well as legos, and other stuff so always check his dustbin before emptying!) Change the brushes often (~3-6 months, They are CHEAP on Amazon), and you will be happy! We did change the battery at about ~15 months, but honestly Mr. Sucky for how much value we have got from him has been very maintenance free. I can't recommend him enough."",""Reviewed in the United States on September 14, 2020""";;
"20,""Got this on a flash sale for a great price! Had Roomba before so expectations were there. This Deebot really cleans well, lasts over 2 hours on a full charge too! Pretty easy to clean. Only con is the phone app only syncs on 2.4, the remote is handy but """"touchy"""". Deebot gets stuck under certain counters doing """"edge"""" cleaning too often. Still all in all does a far better job than my old Roomba, recommend this highly!<U+0001F609>"",""Reviewed in the United States on September 14, 2020""";;
"21,""It worked well at first. Unfortunately now it will not even run after minimal use."",""Reviewed in the United States on September 13, 2020""";;
"22,""I really like this robot more than any others and there’s multiple reasons for that. First of all it cleans the pet hair pretty well and it’s thinner than other ones so it gets underneath of everything even the one that I can’t reach easily, only thing I had trouble with is using with the WiFi. App doesn’t show this model so I wasn’t able to set it up and work it through with Alexa."",""Reviewed in the United States on September 13, 2020""";;
"23,""It broke a few months after I got it. I sent it back to the company because it wouldn't charge. They """"repaired it"""" and shipped back to me. Still doesn't work. I'm sending it back a second time."",""Reviewed in the United States on September 12, 2020""";;
"24,""It simply stops at the edge of the rug.  Perhaps this is common to all robotic vacs, I don't know since this is my first, and last, one. I returned it."",""Reviewed in the United States on September 12, 2020""";;
"25,""The vacuum died just after a year as the brush motor failed. I have read that this is an issue with this product. Terrible customer service would not help us at all. Would recommend looking at a different product."",""Reviewed in the United States on September 12, 2020""";;
"26,""Worked great for about 4.5 weeks. Great suction power, covered a lot of ground. It does get caught often on loose rug ends. After 4.5 weeks, completely died and won't turn on. Contacted ECOVAAC support - had to ship it to them and was without it for 2 weeks. They just shipped me back a refurbished product."",""Reviewed in the United States on September 12, 2020""";;
"27,""If you have hardwood floors you know how much dust accumulates in all the corners and hallways. This was a problem because one of our allergies start kicking in. This machine can automatically clean up the small debris that are just left on the ground on a daily basis. I really like how there is an advanced filter on the collection tray. It really keeps fine particles from getting through. I purchased this vacuum because my wife had really wanted on since we moved in to our home. There were several much more expensive units but this one really gets the job done. I first used it right after a deep clean full size vacuum run and noticed this still picked up a whole lot of things the other vacuum did not. I also love that you can control it over the app on your phone from anywhere! The wife is happy too!"",""Reviewed in the United States on September 11, 2020""";;
"28,""Loved it for about a year and a half, then it stopped working. Went through all of the troubleshooting with customer service and they wanted us to send it to their repair company which sounded sketchy (the name was ifixrobot) and was going to be expensive and not worth it. The vacuum worked great for just over a year and just over their year long warranty. We threw it away and got a Roomba."",""Reviewed in the United States on September 10, 2020""";;
"29,""The cleaning isn't the most efficient but it did the job for 1.5 years in my small apartment. Sadly, the motor suddenly won't spin the brush anymore. After contacting support, they told me that I should buy a new one or pay to fix it. Not exactly the support or longevity I hoped for."",""Reviewed in the United States on September 10, 2020""";;
"30,""I liked this vacuum for the first year. It did a great job at keeping the cat hair and litter dust to a manageable level. Where this vacuum fails is in longevity. We bought this vacuum two years ago. The first year it ran daily just fine. Then we moved to a different apartment where we had to monitor it a lot because it was getting stuck on everything (not the vacuums fault, just a poor layout). So we hardly used it the second year. Now we are in a perfect apartment for it, but it seems to be having both a battery and a brush motor problem. We keep getting this 4 beep error when it's done charging (Google it, it's a common problem with no solid solution), and I've been having to take it apart once a week to clean tiny strands of hair and dust from the main brush motor because we keep getting a 4 beep error when it is running (cleaning the motor stops the error for about a week).After a lot of googling and reading endless twitter chains where the customer support refused to confirm whether any solutions were available, I finally emailed support and asked for a solution. They absolutely refuse to tell me whether replacing the battery will help, or if there are any troubleshooting options. They claim that replacing the battery is a safety issue. It really isn't. The battery is clearly designed to be user replaceable and they sell them on Amazon, but support refused to say whether that might help or not. They did give me a link to their """"partner"""" company that can repair the vacuum.These issues seem to be common across their whole line of vacuums, so I would advise avoiding this company all together."",""Reviewed in the United States on September 10, 2020""";;
"31,""I didn’t buy it from Amazon but I figured I post a review here since it would get a lot more views.  Soooo.. what do I think about this vacuum?  Well, It does a good job vacuuming.. it picks up quite a bit of dirt and hair every single time it goes out but this thing is as dumb as it gets.. it roams aimlessly thru the house.. like there is zero intelligent path that will result in an effective cleaning, so you will have random spots missed all over the house and If you have couches that are barely high enough for the robot to get under you can 100% count on it getting stuck.. and trust me.. it will happen often.  Lastly.. this robot is so dumb that it will literally take 15-20 mins to find the charging station (even if it is in the middle of a wide open living room) and 8 out of 10 times it won’t find it so you will have to go on a hunt for the robot all over the house wherever it died and pick it up to put it in the charging station.. other than that it is great for the price."",""Reviewed in the United States on September 9, 2020""";;
"32,""Machine worked well when it worked. Since buying this machine last November I’ve had to return it 3 times. The customer service is horrible. Many of the representatives are hard to understand and the whole return process is flawed to say the least. My latest return came back with all the brushes missing. The unit is useless without the brushes. I’ve called many times but have yet to receive the replacement brushes: Do yourself a favor. Spend a little more money and get the Roomba."",""Reviewed in the United States on September 9, 2020""";;
"33,""I've always kept up with maintenance on the unit to ensure peak performance. But like many, mine started having the 4 beeps of death after a year of use. I will no longer be endorsing ECOVACS to friends and family!"",""Reviewed in the United States on September 9, 2020""";;
"34,""Worth the price. Picks up cat hair and cleaned the floor very well."",""Reviewed in the United States on September 8, 2020""";;
"35,""Well it was nice while it lasted - after less than a year my deebot has stopped charging. I tried purchasing a battery for 20 bucks and still no luck - it will start charging when docked and then stop charging after 5 mins. It won’t even start now :("",""Reviewed in the United States on September 7, 2020""";;
"36,""Works Great, Thank you!"",""Reviewed in the United States on September 6, 2020""";;
"37,""We’ve had our Deebot for over two years and have zero complaints.  Does a great job cleaning.  We’re surprised about how much it picks up.  Always shocked when we dump the collection bin.  Would recommend it 100%."",""Reviewed in the United States on September 6, 2020""";;
"38,""Hes definitely good for the price, he gets lost sometimes and needs help getting home but definitely helpful for those days in between vacuuming!"",""Reviewed in the United States on September 5, 2020""";;
"39,""Quiet and doesn’t hit the walls—it hovers and then turns before it hits the wall.  It is wonderful."",""Reviewed in the United States on September 4, 2020""";;
"40,""The product has worked well for a number of years. When I had an issue (the battery died) customer service was prompt and helpful."",""Reviewed in the United States on September 4, 2020""";;
"41,""I purchased this DEEBOT and it only lasted almost a year. Then it just started beeping like crazy  - It beeps 5 times when it is on the charging station and it can only clean about 15 or 20 minutes then it had to go back to charge station. Therefore, it became useless to me.I live in a three levels home so I have another 2 Roomba by iRobot - one of them lis about 8+ years old (pet series 595) and another one about 5 years old. Both Roombas are still running fine. I think for the money I paid for DEEBOT, I wanted it to last for more than a few years. Will not recommend Deebot  to anyone at all."",""Reviewed in the United States on September 4, 2020""";;
"42,""Excelente poder de limpieza.Elimina a profundidad lis pelos de mascotas"",""Reviewed in the United States on September 3, 2020""";;
"43,""Lousy at deep cleaning carpet, but then again, you kinda get what you pay for.  This vac is inexpensive and I can't compare it to more expensive robovacs.  But....it gets hung up in the metal frame of my coffee table and dining rooms chairs.  It may disappear under my entertainment center.....and never come out.  It actually ran directly over a feather on my carpet, and didn't pick it up.  But it does a good job on kitchen and bath floors, as long at it doesn't get hung up on my weight scales.  Really, its greatest value.....when I turn it on my dog gets up on the couch with me and the both of us sit and watch it motor around the living room like a pin ball in slow motion.  Call it pandemic entertainment."",""Reviewed in the United States on September 3, 2020""";;
"44,""Started getting motor failure notifications and robot stopped running after 3-5 minutes when trying to get it back and running."",""Reviewed in the United States on September 3, 2020""";;
"45,""I couldn’t be happier with Bertha (my kids even named it). It makes me wish I bought it earlier. I never had any other robot vacuum to compare but this one does a very good job. It does get stuck with shoe laces or iPhone cables, but it forces you to pick them up and have a obstacle-free floor for Bertha to work."",""Reviewed in the United States on September 3, 2020""";;
"46,""Got this and used it for a few days. It was great with suction and I love that it can go back to the charging port by itself.  However, when it comes to go near a stair/steps, i noticed it gets confused and at time will fall through the steps.  Wished the sensor was a lot better and can pre-detect the surface and avoid these small colission."",""Reviewed in the United States on September 2, 2020""";;
"47,"" Product is awesome while it works, but longevity is an issue. Ours worked fine for about 8 months, until we started having the issue in the attached video. Problem is related to the anti-drop sensors. We have cleaned the vacuum religiously since purchase, so I believe it is a product defect.To Ecovac’s credit, they accepted our warranty claim and are in the process of repairing the unit because we had an issue in the first year. Hopefully the repaired vacuum will last much longer. If we have any issue after 4 months from now, we’ll be on our own.While Ecovac’s customer service is appreciated, I would recommend another manufacturer to a prospective buyer. I just fee that the product is not as well made as some of the competitors in the marketplace. Issues related to computerized parts should not happen within the first year."",""Reviewed in the United States on September 2, 2020""";;
