",""X1"",""X2""";;
"398,""This vacuum worked great for 6 months, then it suddenly stopped running and will not connect to WiFi or the remote. We loved it when it worked, however it is not worth the price for only working 6 months. It’s been sitting for a few while we have looked up ways to reset it."",""Reviewed in the United States on April 22, 2020""";;
"399,""Worked great for the it’s life under warranty. Malfunctioned shortly after the 1 year warranty expired. Customer service seemed to be well in the know of the malfunctioning issue."",""Reviewed in the United States on April 22, 2020""";;
"400,""First this Alexa app/device does nothing useful and after using it for quite a while and spending way too much money on stupid devices I can tell you this Alexa thing is stupid and a waste of time and money. Do yourself a favor and just shoot yourself in the head before buying these devices. I can turn lights on and off much better and easier without Alexa. I can search better I can select music better in fact I can do everything better than Alexa.  My life was better before Alexa and I was not angry before Alexa. She hardly ever understands what you ask her for and buy the time you repeat yourself over and over you should of just did it yourself. These AI devices are junk and have no useful purpose currently."",""Reviewed in the United States on April 22, 2020""";;
"401,""Worked well for the first year, then it started bumping into everything and then after 1.5 years the side brushes did not work anymore.Would not recommend to buy."",""Reviewed in the United States on April 22, 2020""";;
"402,""I got this as a gift, after about 9 months, it stopped working. This robot does nothing super hard, I live with all hardwood floors in a 300 square foot small one-bedroom apartment. They were great, sent me a new one, told me to send the old one back. Here we are 8 months later. Same error, same issue, but now my warranty has lapsed because of the original one they sent. The same thing happened to my mother's. Pay more for a more reputable company."",""Reviewed in the United States on April 21, 2020""";;
"403,""Worked well until it completely gave out. Battery will not hold a charge any longer and there is no way to get it to power back on. No option to have it replaced, we hadn't even had it for a year."",""Reviewed in the United States on April 21, 2020""";;
"404,""I bought this vacuum cleaner on November 18, 2018 and it suddenly stopped working a week ago April 12, 2020. The side brushes stopped turning and the robot simply rolls for a couple of seconds and comes to a complete stop and bips for malfunction (app states side brush malfunction). I have provided maintenance to this vacuum cleaner every two weeks as advised by the manual, I've changed the brushes and filters many times in order to ensure this cleaner will last us a good amount of years but it is clearly so poorly built, it is made to fail just a few months after the warranty expires (warranty is one year). I contacted the joke they call customer service, who told me in a very rude way that they were aware of this type of issues, that it was common after 15-18 months and told me to deal with it and either buy a new one or get it repaired at a cost that is close to the price of a new one. This is planned obsolescence at its best! So, you can believe the good reviews as it does the job, it cleans pretty well but it will ultimately fail you after a year and a half! This is a really poor quality robot vacuum cleaner but I guess you pay for what you get! I would never recommend that brand to anybody and instead, advise any of you to pay the extra and get a solid robot vacuum cleaner the likes of Irobot Roomba or Shark IQ or even Roborock.  Save your money, AVOID BUYING THIS PRODUCT!"",""Reviewed in the United States on April 20, 2020""";;
"405,""Great price ,it does a very good job , I just wish it self emptied, but it does everything else you would need"",""Reviewed in the United States on April 20, 2020""";;
"406,""This vacuum has issues with the motor jamming.  Ours did it in the first 4 months.  We have cleared the jam several times, but it still does not function properly.  Warranty is very short.  I would not buy this again."",""Reviewed in the United States on April 19, 2020""";;
"407,""Here's what I can say at 18 months of ownership, the app no longer supports the vacuum and the front wheel had to be replaced because it got to the point where it would not turn and cause the vacuum to think it was stuck, it goes to its charger (usually) then beeps 4 times for about 2 or 3 minutes than will not run again unless you press the button on the vacuum itself.It started off great, but whether this is just to low end a model or the company hasn't been developing these long enough, either way, save your money and either buy another robot or wait a few more years for the sector to be more developed.Overall a disappointing purchase to have to consider it junk after a year and a half."",""Reviewed in the United States on April 18, 2020""";;
"408,""It's amazing <U+0001F44F>"",""Reviewed in the United States on April 18, 2020""";;
"409,""Product picks up so much hair. We vacuumed weekly and this guy picked up dust and hair for a whole week after we bought it."",""Reviewed in the United States on April 18, 2020""";;
"410,""This thing is ok as a supplemental vacuum but it’s not ready to replace your main vacuum and you can’t really leave it alone.My main issue with this is that it gets stuck on EVERYTHING. The main thing that drives me crazy is when it gets stuck on a floor vent.  Just going around through the room and then it’s stuck. It also gets stuck on cords or near power strips or on furniture legs.It’s running right now and shadows seem to be causing it to think there’s a wall so it’s avoiding certain areas.It also seems to go the same places over and over and over again while missing large other sections.When I do run it, I have to go around the room securing cords and propping up obstacles to keep it from going under certain pieces of furniture.It does keep the toddler entertained so that’s a plus, but the issues of it getting stuck so frequently cause me to use it less than I would like."",""Reviewed in the United States on April 18, 2020""";;
"411,""Bought this for my wife at Christmas.  Worked ok a couple times and have had problems since.  Now it has completely failed and will do nothing.  Wouldn’t recommend purchase of this product."",""Reviewed in the United States on April 18, 2020""";;
"412,""This thing is a Roomba killer, it is amazing how well it functions for this price point. Had it for two years now, still runs perfectly. We have hardwood floors and lots of beagle hair. Can't wait to upgrade to another deebot!"",""Reviewed in the United States on April 17, 2020""";;
"413,""Buyer beware! This vacuum is trash. It has always been maintained and used as recommended however, it stopped working properly (running into walls, tables, etc. and leaving marks). This happened at the 10 month mark. After much back and forth (even though it was still under warranty) I was sent what should have been a new vacuum. Nope. Refurbished. Fine, not a big deal. Here’s the next issue... 6 months into using the replacement vacuum, one of the side brushes stops working. There was nothing tangled, the motor seized. I contact Ecovacs again just to be told, “sorry, your warranty has expired!” The replacement failed and carried no warranty of its own. There have been over 40 emails now and I am just being told that it will not be fixed or replaced. They admit via email that they could have sent me a defective replacement, but there “strict return policy” does not allow for them to address the issue. Unreal."",""Reviewed in the United States on April 17, 2020""";;
"414,""I agree with many other reviewers. Worked great for six months and then started crashing in to everything. Customer service said to clean the sensor with car headlight cleaner, which I did and it did'nt work. They know these problems exist because there are complaints online and even a youtube video. I was also told to hit the middle of the sensor window and bumper 5 times hard until I heard a click???  Bottom line is Ecovacs was sent all the proof they needed, a video clip of it crashing, pdf of the purchase & invoice, 4 phone calls later and they still refused to honor their limited warranty.  Don't waste your money because the vacs will not last. Buy from a reputible manufacturer that stands behind their products."",""Reviewed in the United States on April 16, 2020""";;
"415,""The product has a lot of features and works well....when it works! The second day got a main brush malfunction.  Cleaned emptied the debris bin, which is EXTREMELY small, then set it up again.  Ran for about another 20 minutes or so, same message.  Nothing caught or tangled.  Tried a third time...you guessed it...Then called customer service, as requested in instructions.  It was a call center employee who obviously was working from home (TV in background). Her solution was to check often, while cleaning,  to insure the vacuum is working.  ??? Also go to website and buy a second container.  Hmmmm buy another container to empty my """"auto vac"""" that is supposed to run at least an hour.  My apt is less than 1300sf and I vacuum and shampoo carpet prior to purchasing.  Point,  this may work well in a home less than 1000sf and minimal carpet.  The return to dock works ok and the app and remote function well.  But I am definitely getting another one,  but 2nd guessing if it will be an ecovacs brand."",""Reviewed in the United States on April 16, 2020""";;
"416,""This is a useless product.  You have to be on top of it all the time, which looses its value.  It is easier to do it yourself than to use it.  If I could return it, I would do it immediately.  Had it without using it for 8 months because I had other urgent issues to deal with but finally have time to write my review because my view has not changed."",""Reviewed in the United States on April 16, 2020""";;
"417,""Worked great for first few weeks then stopped working, they shipped us a new one after haggling with the company. Again worked great for awhile AND SAME ISSUE, arm brushes broke, sensors don’t work so the whole machine won’t even turn on as it is in an error state. After a couple weeks of back and forth with the company they won’t fix it but will point us in the right direction to purchase replacement parts. Do NOT waste your money, this device will NOT last and the customer service of the company is HORRIBLE! Do yourself a favor and just go with the better known brand, it may cost a little more up front but it will save you a lot of hassle."",""Reviewed in the United States on April 16, 2020""";;
"418,""Purchased one of these in November 2018, by Dec. of 2019 I had replaced it three times through warranty. The area I use this in is not complicated. Single level, one low-pile area rug, hardwood and tile. when it woked it worked well but within a month of having it it started to make a loud clicking noise, replaced then months later same issue and again. Finally, I stopped it's scheduled cleaning because it would eat the tree skirt. When the tree was gone I attempted to turn it's programming back on but with no luck. It would not connect to the wifi/app so I figured, """"first world problem"""" and tried to send it out manually by just hitting the """"clean"""" button. But it would just push away from the dock and spin in circles until it gave up and beeped until i placed it back on the dock. Tried to get it replaced yet again and I was told the one year warranty was up even though this vacuum was only 4 months old. I am investing in a vacuum that won't break every 6 weeks and would never recommend this company to anyone."",""Reviewed in the United States on April 16, 2020""";;
"419,""We purchased this item just knowing we were waisting our money. We were wrong. I'm surprise how much dust and dog hair it picks up off the floor even after we've cleaned. Great buy."",""Reviewed in the United States on April 16, 2020""";;
"420,""I guess I forgot to review this vacuum soon after we got it but glad I did. You need to know we have had this vacuum for almost 3 years now and it still works great, picks up lots of things you think you picked up with your large hand-operated vacuum. I cannot believe what I get out of this Deebot!! Tip #1 you will need some headlight cleaner from the automotive dept store that makes old headlights look new again. I have had to use it twice to give the Deebot 20/20 vision again. After a period of time, it begins to bump into things and when this does it's because the windshield has become dirty or foggy and it is not seeing clearly, use the headlight cleaner and it runs like new, not bumping into items. Tip #2 use an old soft 2- 1/2"""" trim paint brush keep it in the garage by your trash can and regularly dump and gently brush your contents container along with your filters. If you do those two things you should have a great vacuum with a long life! Enjoy"",""Reviewed in the United States on April 15, 2020""";;
"421,""So far so good! Very happy!"",""Reviewed in the United States on April 15, 2020""";;
"422,""Good"",""Reviewed in the United States on April 15, 2020""";;
"423,""This is our second Ecovacs. And both only lasted short of a year. In both cases one of the wheels started working and the vacuum was going in circles. You should expect that these last several years but not these. We have also Roomba's and they last forever. So to make it short...stay away from Ecovacs if you want something that lasts."",""Reviewed in the United States on April 15, 2020""";;
"424,""Vacuum stopped working almost exactly one year from purchase. BUYER BEWARE!!!!!!!!!YOU WILL GET THE EXTREME RUN AROUND BY CUSTOMER SERVICE!!!!!!!!! They are deliberately unhelpful... a VERY shady operation!! BEWARE BEWARE!!!!!!!!!!!They acknowledged a defective unit and promised a replacement..... again.... BEWARE!!!!!!!!!!"",""Reviewed in the United States on April 14, 2020""";;
"425,""After just a year the thing is constantly throwing errors. It wont run for more than a minute before it stops starts beeping loudly and flashing red. Would not recommend if you want something to auto run every night."",""Reviewed in the United States on April 14, 2020""";;
"426,""Have three! Enough said!"",""Reviewed in the United States on April 14, 2020""";;
"427,""I gave 2 stars because it only lasted 14 months. Great vacuum but should last longer than 14 months. I was very impressed with this vacuum until it started giving continuous error codes. I did everything that was asked. Changed all brushes, cleaned sensors and reset as instructed. Nothing. Runs 1 minute and then stops and beeps. Customer service told me to reset, which I did. Nothing. I was told since it’s over a year, I have to pay to have it repaired by a 3rd party.  So, I pay to ship it, they find problem and give me a price for repair. I then have to pay to have them ship it back. No way!  I’m very disappointed. I loved this vacuum so much that I recommended it to several friends before mine died.  One of my friend’s Deebot stopped working at the year mark also. Same model. Maybe this model is defective. Who has $150 to shell out for a vacuum every year?Disappointed"",""Reviewed in the United States on April 13, 2020""";;
"428,""I purchased this in December of 2018 and am writing this review in April of 2020. In that time, I've had two replacements (3 total vacuums) and in need of a third replacement (a 4th vacuum). However, since my original purchase is outside the warranty terms of service, I will not be getting a 3rd replacement (according to the CSR and their Manager). 6 months into this purchase the side brush motor failed. It was doing nothing but spinning freely. I received a replacement for that, with a vacuum that would turn itself on every night at midnight. Even after completing the factory reset as suggested by customer service. So, I got a replacement for that vacuum. Now finally 6 months after that replace, vacuum #3 is having the same side brush motor issue as vacuum #1, however, the warranty is not one year from the receipt of the vacuum, but rather your original purchase date. SAVE YOUR MONEY - YOU WILL GET EXACTLY WHAT YOU PAY FOR.  This vacuum is not smart, it does not keep track of where it's been, you cannot designate """"no-go"""" zones, and it will break down on you very quickly!"",""Reviewed in the United States on April 13, 2020""";;
"429,""I wanted to love this vacuum, however, they break down QUICKLY!!  I purchased 2 of these vacuums in 2018 and both stopped working within a year's time.  We have wooden floors throughout the house and it does a decent job of picking dirt up.  I would NOT purchase for a house with carpet, not enough suction for that.  My biggest issue though is the lifespan of the vacuum and the awful customer service.  They replaced my first two vacuums, but now I have a broken replacement vacuum (yes, I follow all maintenance guides they give) less than a year after receiving it.  Their warranty starts from the purchase of the original vacuum and does not start again if you receive a replacement.  So now I am stuck with a broken $200 vacuum and no help from the company.  I would STAY AWAY from this vacuum and continue your search.  There are much better robotic vacuums and companies with better customer service out there!"",""Reviewed in the United States on April 13, 2020""";;
"430,""It doesn't clean the entire area. Bangs into furniture, won't go on certain fibers of carpet."",""Reviewed in the United States on April 13, 2020""";;
"431,""This robot vacuum is fantastic.  We have had it for 6 months as of 4/2020. From human hair to dust and dirt, the vacuum performs well.  The pre filters are easy to rinse and with removal of a few small screws you can pull the hair off the roller brush.  Deebot has learned our 1 floor apartment and rarely bumps into objects and furniture.  Even with a few bumps it has never damaged anything."",""Reviewed in the United States on April 12, 2020""";;
"432,""I really liked this product at first.  It was amazing how much it actually picked up between heavy vacuuming.However at the year mark (of course that's the warranty),  it started to act crazy,  have a mind of is own bumping into things... and makes a lot of noise.  Not sure if I'm supposed to take it apart and clean it or what... but wanted to share."",""Reviewed in the United States on April 12, 2020""";;
"433,""Worked well for 2 years.Then, it stopped working.Deebot starting beeping every 2-3 hours if you didn't run it. Now, it doesn't charge at all and it completely broke down. Deebot no longer works AT ALL.Good if you want something to last 2 years. BAD if you want it to lost longer."",""Reviewed in the United States on April 12, 2020""";;
"434,""Stop working  NOV 2019"",""Reviewed in the United States on April 12, 2020""";;
"435,""Annoying for carpet, perfect for hardwood floors."",""Reviewed in the United States on April 11, 2020""";;
"436,""I bought this 2 years ago and it is still working well!!!! My mom loves this vaccuum cleaner! I decided to write a review after seeing my friend having a robot cleaner of a different brand. I want to say that Ecovacs is not thick as other brands so it can go under my sofas and tv stand. It is a huge advantage!"",""Reviewed in the United States on April 11, 2020""";;
"437,""The vacuum stop working as of March 25, 2020I purchase on 11/29 so the life should be longer than this please exchange.Or I will dispute the credit card payment."",""Reviewed in the United States on April 11, 2020""";;
"438,""I love this thing as if it were a weird additional pet in our home.  I used to have to sweep/ clean up dog hair constantly and it was always driving me crazy.  Now I just run the Deebot whenever.  The. thing seems very durable and is actually quite communicative once you learn what its little beeps mean.  When it turns on it says """"Deebot Go!"""" (not really but that's what I imagine the. beeps mean).  I clean it out, use a scissors to free the brushes - all the parts come apart really easily.  If you need to replace any of the brushes you can order replacement parts but I haven't had to do that.  It does great on lower pile carpets and rugs but I imagine wouldn't be good for shag carpet.If you are a pet owner and tired of cleaning up hair, get a deebot!"",""Reviewed in the United States on April 11, 2020""";;
"439,""First, a word of advice:  To get your vacuum connected to the app, if you have dual-band WiFi in your home, TURN OFF the 5 GHz band completely to for a connection.  You can turn it back on once you’ve connected the app and everything should work as it should after that.This replaced a 3-year-old well-used Deebot that has just worn out, and the quality has improved in the intervening time.  This does a remarkable job pulling cat hair out of our carpet, and it is much quieter.  A robot vacuum will never be as powerful as a regular vacuum, but this seems to do a very good job with the animal hair, which is the main reason we use one.  For the price, especially if you can find a “Like new” one in the Amazon Warehouse, it’s a good choice."",""Reviewed in the United States on April 10, 2020""";;
"440,""Worked fantastic for 1.5yrs. For the price, wish it lasted longer. Connected it to my Google Home and definitely did it’s job...was nice having it."",""Reviewed in the United States on April 10, 2020""";;
"441,""Bought an Ecovacs Deebot N79S via Amazon. It failed after a few months use. Ecovacs replaced the original vacuum and then replaced the replacement unit several times but none last more than 4-7 months before also failing. Each machine had a different failure so I can only conclude Ecovacs sells junk and hopes people will just give up and throw a costly machine away."",""Reviewed in the United States on April 9, 2020""";;
"442,""Worked well, until it didn't. The company told us the battery lasts 5 years, but it's probably not a coincidence that their warranty is 1 year and it died after 15 months. We use it maybe once every couple of weeks, or less, so we probably got 30 cleanings out of it before it died. Company response: please purchase a new battery from us so we can profit again from the defective product that we sold you. Beautiful example of designed obsolescence."",""Reviewed in the United States on April 9, 2020""";;
"443,""Prepare to replace it after a year or so, after the warranty ends. Worked great but now its noisy, and unbearable. I have replaced main brush, side brushes, filter, but still no solution. Will need a new one but hesitant to buy from any Chinese company that asks for your email to use their app, like this one. As soon as I had signed up, I was getting a bunch of junk email, luckily I used a seldom used email address (which is how I found out). Why would an app like this require an email address is beyond me, unless of course, they are selling your contact info as leads to other companies.Updated from 2 to 4 stars: Good live support from company, main brush need to be cleaned at least weekly to keep it tangle free.I still stand by my strong suspicion that Ecovacs is selling your email as leads to other marketers. If it wasn't for this, I would give it 5 stars."",""Reviewed in the United States on April 8, 2020""";;
"444,""This thing was amazing for about 7 months, now it does not turn on. It is clear that it is still able to work, but was programmed to be obsolescent."",""Reviewed in the United States on April 8, 2020""";;
"445,""I would not recommend. Stopped working after a little over a year. Always getting stuck. Left behind things on the floor, did not have a pet."",""Reviewed in the United States on April 7, 2020""";;
"446,""I'm hooked!  I did have to shoot an email to customer service for a link to the app. I guess I had found an old app for my android phone, and this model wasn't listed. But they email me back almost immediately with a link to the app and I downloaded it, connected it to Alexa and it's working awesome.I love the edge feature, where it will just travel around the edge of the walls. That's where most of our dirt ends up.Seriously, you might get nervous because there are some terrible reviews because people can't figure out how to connect it to the app. And honestly, the directions weren't too great. but at least the customer service was spot-on!"",""Reviewed in the United States on April 7, 2020""";;
"447,""Hi purchased this because my dog hates...HATES...the vacuum. This is very quiet and it doesn't bother him. I also really like it! It picks up a surprising amount of stuff. Great for dog hair and dirt and what not. I have hardwood floors with some carpets and it runs seamlessly between the carpets and hardwoods. I do not set it on an automatic schedule because I had a friend whose robot ran over dog poop when she was at work. I just press the button whenever I want a vacuum and watch it run around the house."",""Reviewed in the United States on April 7, 2020""";;
